"common_name","note"
"Iris 1 - Pale purple","Feeding: No.
Flowering: 2012-06-20, at the end of Autumn (Melbourne, Victoria, Australia).
The flowers have a slight but pretty aroma.
Pruning: Divide rhizomes in Summer.
Also: Cut foliage almost to ground level in Autumn."
"Isopogon latifolius","Water moderately.
Frost-hardy.
An evergreen small shrub with large green leaves.
Produces attractive and unusual large pink terminal cone flowers during late Winter and Spring.
Excellent for cut flowers which are long-lasting.
Looks good in the garden or as a container pot.
Prefers a moist, well-drained soil in a sunny position.
Prune after flowering to maintain compact growth.
Mulch and water plants well during dry periods.
Culivate soil before planting..
Dig hole twice the width of the container.
Remove plant from container and place into the hole so the soil level is the same as the surrounding ground.
Fill hole firmly and in well even if the soil is moist.
I am a Fuss Pot!.
Supplier: <a href = 'http://www.kuranga.com.au/'>Kuranga Native Nursery</a>."
"Japanese Spiraea","Feeding: No.
Status: Defunct.
Flowering: 2011-11-14, in Spring (Melbourne, Victoria, Australia).
Pruning: Prune after flowering, removing older branches at ground level."
"Kangaroo Paw 1 - Yellow","This is an Australian native.
Bush Bonanza features large, bright yellow flowers on strong, upright orange/red stems.
The flower stems produce large numbers of blooms that hold their color over several months.
Expect peak flowering from Spring to early Summer, with a secondary flush in Autumn.
It is a perfect plant to grow in a container in a sunny spot.
Full sun. Heat tolerant. Light frost tolerant. Drought tolerant.
Remove old flower stems and leaves as close as possible to their base.
Sprinkle a small handful of slow release fertilizer for native plants around the base of the plant in Autumn and again in Spring.
Water only when the top of the potting mix has dried out.
Keep the center of the plant free of weeds, dead leaves and spent flower stems.
Supplier: <a href = 'https://www.botanicalcreations.com.au/'>Botanical Creations</a>."
"Kangaroo Paw 2 - Red","This is an Australian native.
Stunning iridescent crimson flowers stand tall from the slightly arching foliage creating an impressive display.
Bush Crystal has all the excellent features Bush Gems are known for plus the amazing glow of crimson flowers.
Beautiful on its own or perhaps best enjoyed alongside Bush Diamond and Bush Pearl.
Prolific flowering from Spring to Summer.
Well-drained, sunny location.
Remove old flower stems and leaves as close as possible to their base.
Sprinkle a small handful of slow release fertilizer for native plants around the base of the plant in Autumn and again in Spring.
Water only when the top of the potting mix has dried out.
Keep the center of the plant free of weeds, dead leaves and spent flower stems.
Supplier: <a href = 'https://www.botanicalcreations.com.au/'>Botanical Creations</a>."
"Kennedia beckxiana","A evergreen, vigorous climber with large red and green pea flowers during Spring and early Summer.
A quick-growing climber useful for growing on fences and other garden structures.
Thrives in a sunny location with well-drained soil.
Water regularly after planting.
Tip pruning young plants will encourage dense growth.
Cultivate soil before planting.
Dig hole twice the width of the container.
Remove plant from container and place into the hole so the soil level is the same as the surrounding ground.
Fill hole firmly and water in well even if the soil is moist.
Suits sandy soils.
Attracts birds.
Good for coastal conditions.
Supplier: <a href = 'http://www.kuranga.com.au/'>Kuranga Native Nursery</a>."
"Kennedia coccinea","Vigorous climbing or trailing plant.
Bears orange-red pea-flowers late Winter to early Summer.
Supplier: <a href = 'http://www.kuranga.com.au/'>Kuranga Native Nursery</a>."
"Kennedia macrophylla","Considered a rare species, this climbing plant has broad, bright green leaves, and in Spring and early Summer produces large clusters of read pea-flowers flecked with yellow.
A vigorous climber for fences and walls, especially suited to coastal conditions.
Useful groundcover for embankments.
Suitable for hanging baskets and pots.
Attracts nectar feeding birds.
Grow in an open, sunny position in moist, well-drained soil.
Tolerates coastal conditions and light frost.
Responds well to pruning.
Cultivate soil before planting.
Dig hole twice the width of the container.
Remove plant from container and place into the hole so the soil level is the same as the surrounding ground.
Fill hole firmly and water in well even if the soil is moist.
Good for coastal conditions.
Supplier: <a href = 'http://www.kuranga.com.au/'>Kuranga Native Nursery</a>."
"Kennedia nigricans","A vigorous climber with twining stems carrying striking pea-flowers from Winter to Summer.
The violet-purple or black flowers have a greenish-yellow blotch.
A hardy climber suitable for screening large areas.
Not recommended for small areas or weak supporting frames.
Useful groundcover for embankments.
Attracts nectar feeding birds.
Best grown in a sunny to partly shaded position in well-drained soil.
Tolerates periods of drought, light frost and poor soils.
Prune after flowering to maintain compact growth.
Cultivate soil before planting.
Dig hole twice the width of the container.
Remove plant from container and place into the hole so the soil level is the same as the surrounding ground.
Fill hole firmly and water in well even if the soil is moist.
Good for coastal conditions.
Supplier: <a href = 'http://www.kuranga.com.au/'>Kuranga Native Nursery</a>."
"Kennedia rubicunda","A vigorous climber with twining stems carrying a mass of pea-shaped red flowers from Winter to Summer.
The violet-purple or black flowers have a greenish-yellow blotch.
Ideal for covering large areas such as embankments and fences.
Not recommended for small areas.
Grow in a sunny position in well-drained soil.
Tolerates coastal conditions, dappled shade, light frosts and drought.
Prune after flowering to maintain compact growth.
Cultivate soil before planting.
Dig hole twice the width of the container.
Remove plant from container and place into the hole so the soil level is the same as the surrounding ground.
Fill hole firmly and water in well even if the soil is moist.
Supplier: <a href = 'http://www.kuranga.com.au/'>Kuranga Native Nursery</a>."
"Land cress","Herb, vegetable.
Land cress is considered a satisfactory substitute for watercress.
It can be used in sandwiches, or salads, or cooked like spinach, or used in soup and fish.
Land cress can be grown easily in any garden.
Like watercress, it loves water, but does not do well when partially submerged for long periods of time.
This perennial needs full sun and frequent watering in any garden, unless near a direct source of water.
Supplier: <a href = 'https://acornnursery.com.au/'>Acorn Nursery<a/>."
"Lechenaultia","Small evergreen Australian native shrub with spectacular blue blooms over a long period.
Features: Dwarf, woody stemmed shrub, prized for its massed display of very deep blue flowers.
Flowers age from a deep blue to a paler blue.
Grey-green foliage.
Plants are sometimes spread by suckers.
Originating from Moora, North of Perth.
Suited to very free-draining soils or potting mix in full sun..
Tolerant of sandy to clay loams, light frosts, hard pruning, light dappled shade and hot dry sites.
Tip prune young plants regularly.
Light application of slow release fertilizer may be beneficial.
Mulch well using wood chips or pebbles.
Water over extended dry periods by deep soaking during a cool part of the day.
Great in rockeries or hanging baskets, mixed with Australian natives and/or exotics.
Supplier: <a href = 'http://www.kuranga.com.au/'>Kuranga Native Nursery</a>.
Status: Defunct."
"Lily","50-150cm x 20-30cm. Full sun to semi-shade. Frost hardy.
Lilies thrive in semi-shade in warmer areas, but full sun is easily tolerated in cooler climates.
Soil should be humus rich, moist and well-drained.
Apply a mulch in summer to help retain moisture.
Staking may be required."
"Lovage","Supplier: <a href = 'http://pinewoodnursery.com.au/'>Pinewood Nursery</a>."
"Marigold","Status: Defunct."
"Marmalade Bush","Flowering: 2011-12-20, in the (Melbourne, Victoria, Australia) Spring.
Pruning: Tip prune from an early age. As it becomes bushy, prune back all over immediately flowers are spent.
Feeding: No."
"Mexican Mock Orange","Pruning: No.
Feeding: No."
"Moorpark Apricot","Moorpark is a variety of apricot which has been available in Australia for many years.
PlantNet® now makes it available as a dwarf variety.
Exclusive to PlantNet®, it is a sweet apricot to eat, and the fruit is an oval shape with an orange colour.
It matures around late January, which makes it a mid- to late-season variety.
This is a versatile variety which can be used for stewing, making jams or eaten fresh.
This variety is self-fruitful and is a prolific bearer, which means it will require staking.
A low maintenance tree for confined spaces because of its dwarfing tree size.
Ideal for growing in pots or tubs on the patio or great for small sized gardens.
Growing regions include: Warm semi-arid, Warm temperate, Mediterranean, Cool, Cool temperate.
Breeder: <a href = 'http://plantnet.com.au/'>PlantNet®</a>.
Supplier: <a href = 'http://pinewoodnursery.com.au/'>Pinewood Nursery</a>."
"Morning Glory","Flowering: 2011-11-14, in Spring (Melbourne, Victoria, Australia).
It's a vine.
The flowers are aromatic.
This is not a Moonflower, if only because the flowers are open 24 hours a day.
Pruning: Cut back to keep bushy, if desired.
Feeding: Fertilize twice a year.
Status: Defunct."
"Mugwort","Herb.
Used in smudging and moxa.
Folk remedy for anorexia. Induces dreams.
Perennial.
Moist soils and conditions.
Supplier: <a href = 'http://allrareherbs.com.au'>All Rare herbs</a>."
"Narcissus","The flowers are quite aromatic, but some people might find them a little unpleasant.
Flowering: 2012-06-30, in Winter (Melbourne, Victoria, Australia).
Feeding: No.
Pruning: No.
Status: Defunct."
"Nasturtium","One pot plant is a perennial, dying back at the start of Summer.
The other one crept across the patio and then completely died off.
All parts of the plant - flowers, leaves, stems, rhizomes - can be eaten.
But personally I find the stems cause slight stomach pain.
Leaves can reach 16cm across."
"Nierembergia","Almost blue, cup shaped flowers in Spring and Summer.
For full sun or part shade.
Likes a rich soil and some additional water in hot weather.
Perfect for the cottage garden.
Cut down low to the ground in Autumn.
Supplier: Rippon Lea Estate."
"Parsley","Herb."
"Passionfruit Daisy","Perennial evergreen small shrub.
Easy to go. Likes well-drained soil. Very hardy.
Flowers predominately in Winter, and continues thru the year.
Masses of golden-yellow flowers.
Frequest tipping will stop plant growing leggy.
Attracts birds and butterflies.
Can be potted.
Supplier: <a href = 'https://acornnursery.com.au/'>Acorn Nursery<a/>."
"Pennywort","Herb.
An easily-grown ground cover.
Loves a moist, shady position.
In folk medicine practices it is thought to have therapeutic properties.
<a href = 'http://www.herbherbert.com'>Herb Herbet's Traditional Herbs</a>.
Supplier: <a href = 'https://acornnursery.com.au/'>Acorn Nursery<a/>."
"Philotheca myoporoides","Supplier: <a href = 'http://pinewoodnursery.com.au/'>Pinewood Nursery</a>."
"Plectranthus caninus","This is an attractive member of the mint family originates from South Africa and is particulary hardy.
Lovely long-lasting purple flower spikes year round.
40cm x 40cm.
Supplier: Rippon Lea Estate."
"Plectranthus ecklonii 1","Shade loving, autumn flowering evergreen shrub.
Plant under trees.
Dry tolerant.
Cut back after flowering.
May be clipped back during Spring and early Summer to keep compact.
Supplier: Burnley Horticultural College.
Status: Defunct."
"Plectranthus ecklonii 2","Evergreen shrub.
Dense sprays of pure white flowers late in Summer.
Frost tender.
Supplier: Burnley Horticultural College."
"Plectranthus saccatus","Evergreen shrub.
Green leaves with soft hairs.
Mauve-blue or white flowers.
Low sun to shade.
Allow to dry between waterings.
Supplier: Burnley Horticultural College."
"Purpurea","Supplier: <a href = 'http://botanicalcreations.com.au/'>Botanical Creations</a>."
"Rainbow Chard","Harvest from 6 weeks.
Plant 30cm apart."
